"'%1' file extension is not supported","'%1' extension de fichier non supportée",module,Magento_ImportExport
"Adapter must be an instance of MagentoImportExportModelImportAbstractSource","Adapter doit être une instance de \Magento\ImportExport\Model\Import\AbstractSource",module,Magento_ImportExport
"Adapter object must be an instance of %1","L'objet de l'Adapter doit être une instance de %1",module,Magento_ImportExport
"Additional data","Donnée additionnelle",module,Magento_ImportExport
"Add/Update","Ajouter/Mettre à jour",module,Magento_ImportExport
"Add/Update Complex Data","Ajouter/Mettre à jour des données complexes",module,Magento_ImportExport
"Allowed Errors Count","Nombre d'erreurs admises",module,Magento_ImportExport
"Attribute Code","Code de l'attribut",module,Magento_ImportExport
"Attribute does not has options, so filtering is impossible","Attribut sans option. Filtrage impossible",module,Magento_ImportExport
"Attribute Label","Libellé de l'attribut",module,Magento_ImportExport
"Begin data validation","Commencer la validation des données",module,Magento_ImportExport
"Begin export of %1","Commencez l'exportation de %1",module,Magento_ImportExport
"Begin import of ""%1"" with ""%2"" behavior","Commencez l'importation de ""%1"" avec ""%2"" en comportement",module,Magento_ImportExport
"Cannot determine attribute filter type","Impossible de déterminer le type de filtre attribut",module,Magento_ImportExport
"Cannot find required columns: %1","Impossible de trouver la colonne requise : %1",module,Magento_ImportExport
"Cannot get autoincrement value","Impossible d'obtenir la valeur d'incrémentation automatique",module,Magento_ImportExport
"Check Data","Vérifier les données",module,Magento_ImportExport
"Checked rows: %1, checked entities: %2, invalid rows: %3, total errors: %4","Tranches vérifiées : %1, entités vérifiées : %2, lignes invalides : %3, total erreurs : %4",module,Magento_ImportExport
"Column names: ""%1"" are invalid","Noms de colonne : ""%1"" invalides",module,Magento_ImportExport
"Columns number: ""%1"" have empty headers","Colonne numéro : ""%1"" possède un en-tête vide",module,Magento_ImportExport
"Continue","Continuer",module,Magento_ImportExport
"Created: %1, Updated: %2, Deleted: %3","Crée : %1, Mis à jour : %2, Supprimé : %3",module,Magento_ImportExport
"Custom Action","Action personnalisée",module,Magento_ImportExport
"Data is invalid or file is not uploaded","Les données sont invalides ou le fichier n'a pas été chargé",module,Magento_ImportExport
"Data validation is failed. Please fix errors and re-upload the file..","La validation des données a échoué. Veuillez corriger les erreurs et recharger le fichier.",module,Magento_ImportExport
"Data validation is failed. Please fix errors and re-upload the file.","La validation des données a échoué. Veuillez corriger les erreurs et recharger le fichier.",module,Magento_ImportExport
"Delete","Supprimer",module,Magento_ImportExport
"Delete Entities","Effacer les entités",module,Magento_ImportExport
"Destination directory is not writable","Le répertoire de destination n'a pas les droits en écriture",module,Magento_ImportExport
"Destination file is not writable","Le fichier de destination n'a pas les droits en écriture",module,Magento_ImportExport
"Destination file path must be a string","Le chemin du fichier de destination doit être une chaîne de caractères",module,Magento_ImportExport
"Done import data validation","Validation des données terminée",module,Magento_ImportExport
"Download","Télécharger",module,Magento_ImportExport
"Download full report","Téléchargez le rapport complet",module,Magento_ImportExport
"Download Sample File","Télécharger le fichier d'exemple",module,Magento_ImportExport
"Duplicate Unique Attribute for '%s'","Doublon attribut unique '%s'",module,Magento_ImportExport
"Entity adapter object must be an instance of %1 or %2","L'objet de l'Adapter doit être une instance de %1 ou %2",module,Magento_ImportExport
"Entity Attributes","Attributs d'entité",module,Magento_ImportExport
"Entity is unknown","L'entité est inconnue",module,Magento_ImportExport
"Entity Type","Type d'entité",module,Magento_ImportExport
"Error File","Fichier d'erreur",module,Magento_ImportExport
"Error in data structure: %1 values are mixed","Erreur dans la structure de données: %1 des valeurs sont mélangées",module,Magento_ImportExport
"Error message","Message d'erreur",module,Magento_ImportExport
"Errors limit (%1) reached. Please fix errors and re-upload file.","Nombre d'erreurs (%1) atteint. Corrigez les erreurs et renvoyez le fichier.",module,Magento_ImportExport
"Exclude","Exclure",module,Magento_ImportExport
"Execution Time","Temps d'exécution",module,Magento_ImportExport
"Export","Exporter",module,Magento_ImportExport
"Exported %1 rows.","%1 lignes exportées.",module,Magento_ImportExport
"Export File Format","Format du fichier d'export",module,Magento_ImportExport
"Export has been done.","Export effectué.",module,Magento_ImportExport
"Export Settings","Paramètres d'export",module,Magento_ImportExport
"Field separator","Séparateur de champs",module,Magento_ImportExport
"File does not contain data.","Le fichier ne contient aucune donnée.",module,Magento_ImportExport
"File does not contain data. Please upload another one","Le fichier ne contient pas de données. Veuillez en charger un autre",module,Magento_ImportExport
"File format is unknown","Le format de fichier n'est pas reconnu",module,Magento_ImportExport
"File is partially valid, but import is not possible","Le fichier est partiellement valide, mais l'import est impossible",module,Magento_ImportExport
"File is totally invalid. Please fix errors and re-upload file.","Fichier invalide. Veuillez corriger les erreurs et le recharger.",module,Magento_ImportExport
"File is valid, but import is not possible","Le fichier est valide, mais l'import est impossible",module,Magento_ImportExport
"File is valid! To start import process press ""Import"" button","Le fichier est valide. Cliquez sur le bouton ""Importer"" pour démarrer le processus d'import",module,Magento_ImportExport
"File to Import","Fichier à importer",module,Magento_ImportExport
"File was not uploaded","Le fichier n'a pas été chargé",module,Magento_ImportExport
"File was not uploaded.","Le fichier n'a pas été chargé.",module,Magento_ImportExport
"Filter","Filtre",module,Magento_ImportExport
"Following Error(s) has been occurred during importing process:","Une succession d'erreurs se sont produites pendant le processus d'importation :",module,Magento_ImportExport
"For Type ""Local Server"" use relative path to Magento installation, e.g. var/export, var/import, var/export/some/dir","Pour le type ""serveur local"", utiliser un chemin par rapport à l'installation Magento.
                                ex. var/export, var/import, var/export/some/dir",module,Magento_ImportExport
"For Type ""Local Server"" use relative path to Magento installation,
                                e.g. var/export, var/import, var/export/some/dir","Pour le type ""serveur local"", utiliser un chemin par rapport à l'installation Magento.
                                ex. var/export, var/import, var/export/some/dir",module,Magento_ImportExport
"From","De",module,Magento_ImportExport
"Header column names already set","L'en-tête des noms de colonnes a déjà été défini",module,Magento_ImportExport
"History","Historique",module,Magento_ImportExport
"ID","ID",module,Magento_ImportExport
"Images File Directory","Répertoire des fichiers d'image",module,Magento_ImportExport
"Import","Importer",module,Magento_ImportExport
"Import Behavior","Comportement d'import",module,Magento_ImportExport
"Import data validation is complete.","La validation des données pour l'importation est terminée.",module,Magento_ImportExport
"Imported File","Fichier importé",module,Magento_ImportExport
"Import/Export","Importer/Exporter",module,Magento_ImportExport
"ImportExport: Import Data validation - Validation strategy not found","ImportExport : Validation des données d'import - stratégie de validation introuvable",module,Magento_ImportExport
"Import has been done successfuly.","Import réalisé avec succès.",module,Magento_ImportExport
"Import History","Historique d'import",module,Magento_ImportExport
"Import history","Historique d'import",module,Magento_ImportExport
"Import Settings","Paramètres d'import",module,Magento_ImportExport
"Import successfully done","Importation terminée avec succès",module,Magento_ImportExport
"in rows","dans les lignes",module,Magento_ImportExport
"in rows:","dans les lignes :",module,Magento_ImportExport
"Invalid behavior token for %1","Jeton de comportement invalide pour %1",module,Magento_ImportExport
"label","libellé",module,Magento_ImportExport
"Make sure your file isn't more than %1M.","Assurez-vous que votre fichier ne dépasse pas %1Mo.",module,Magento_ImportExport
"Maximum error count has been reached or system error is occurred!","Le nombre d'erreur maximum a été atteint ou une erreur système est survenue !",module,Magento_ImportExport
"Multiple value separator","Séparateur de valeur multiple",module,Magento_ImportExport
"Note: Product IDs will be regenerated.","Remarque : les ID de produit seront régénérés.",module,Magento_ImportExport
"Only first 100 errors are displayed here. ","Seules les 100 premières erreurs sont affichées ici. ",module,Magento_ImportExport
"Please correct the data sent.","Veuillez rectifier les données envoyées.",module,Magento_ImportExport
"Please correct the data sent value.","Veuillez corriger la valeur des données envoyées.",module,Magento_ImportExport
"Please correct the file format.","Veuillez corriger le format de fichier.",module,Magento_ImportExport
"Please correct the value for '%1' column","Veuillez corriger la valeur de la colonne ""%1""",module,Magento_ImportExport
"Please correct the value for ""%1"" column.","Veuillez corriger la valeur de la colonne ""%1"".",module,Magento_ImportExport
"Please correct the value for '%s'.","Saisir une valeur correcte pour '%s'.",module,Magento_ImportExport
"Please enter a correct entity.","Veuillez saisir une entité correcte.",module,Magento_ImportExport
"Please enter a correct entity model.","Veuillez entrer un modèle d'entité correcte.",module,Magento_ImportExport
"Please enter a correct entity model","Veuillez entrer un modèle d'entité correcte",module,Magento_ImportExport
"Please fix errors and re-upload file.","Veuillez corriger les erreurs et recharger le fichier.",module,Magento_ImportExport
"Please fix errors and re-upload file or simply press ""Import"" button' ' to skip rows with errors","Veuillez corriger les erreurs et recharger le fichier ou cliquez sur le bouton ""import"" pour ignorer les lignes avec des erreurs",module,Magento_ImportExport
"Please provide filter data.","Veuillez fournir des données de filtrage.",module,Magento_ImportExport
"-- Please Select --","-- Faire un choix --",module,Magento_ImportExport
"Please specify a source.","Veuillez spécifier une source.",module,Magento_ImportExport
"Please specify number of errors to halt import process","Veuillez préciser le nombre d'erreurs pour arrêter le processus d'importation",module,Magento_ImportExport
"Please specify the writer.","Veuillez spécifier l'auteur.",module,Magento_ImportExport
"Please specify writer.","Veuillez spécifier un auteur.",module,Magento_ImportExport
"Replace","Remplacer",module,Magento_ImportExport
"Replace Existing Complex Data","Remplacer les données complexes existantes",module,Magento_ImportExport
"Select File to Import","Sélectionner le fichier à importer",module,Magento_ImportExport
"Show more","Afficher plus",module,Magento_ImportExport
"Sorry, but the data is invalid or the file is not uploaded.","Désolé, mais les données sont invalides ou le fichier n'a pas été chargé.",module,Magento_ImportExport
"Source file coping failed","Echec de la copie du fichier source",module,Magento_ImportExport
"Source file moving failed","Erreur lors du déplacement du fichier source",module,Magento_ImportExport
"Source is not set","La source n'est pas définie",module,Magento_ImportExport
"Start Date&Time","Date & heure de début",module,Magento_ImportExport
"Status","Statut",module,Magento_ImportExport
"Summary","Résumé",module,Magento_ImportExport
"System doesn't allow to get file upload settings","Le système ne permet pas d'obtenir les paramètres de chargement du fichier",module,Magento_ImportExport
"The adapter object must be an instance of %1.","L'objet de l'adaptateur doit être une instance de %1.",module,Magento_ImportExport
"The adapter type must be a non-empty string.","Le type d'adaptateur doit être une chaîne non vide.",module,Magento_ImportExport
"The adapter type must be a non empty string.","Le type d'adaptateur doit être une chaîne non vide.",module,Magento_ImportExport
"The behavior token for %1 is invalid.","L'analyse transactionnelle pour %1 est invalide.",module,Magento_ImportExport
"The destination directory is not writable.","Le répertoire de destination n'est pas accessible en écriture.",module,Magento_ImportExport
"The destination file path must be a string.","Le chemin du fichier de destination doit être une chaîne.",module,Magento_ImportExport
"The entity adapter object must be an instance of %1 or %2.","L'objet de l'adaptateur d'entité doit être une instance de %1 ou %2.",module,Magento_ImportExport
"The export is finished.","L'exportation est terminée.",module,Magento_ImportExport
"The file is valid, but we can't import it for some reason.","Le fichier est valide, mais nous ne pouvons pas l'importer pour une raison inconnue.",module,Magento_ImportExport
"The file was not uploaded.","Le fichier n'a pas été chargé.",module,Magento_ImportExport
"The file you uploaded has no extension.","Le fichier que vous avez envoyé n'a pas d'extension.",module,Magento_ImportExport
"The header column names are already set.","Les noms de colonnes d'en-tête sont déjà définis.",module,Magento_ImportExport
"The import was successful.","L'importation a réussi.",module,Magento_ImportExport
"The input entity code is not equal to entity adapter code.","Le code entrée d'entité ne correspond pas au code de l'adaptateur de l'entité.",module,Magento_ImportExport
"There is no data for export","Aucune donnée à exporter",module,Magento_ImportExport
"There is no data for the export.","Il n'existe aucune donnée pour l'exportation.",module,Magento_ImportExport
"There is no sample file for this entity.","Il n'y a pas de fichier d'exemple pour cette entité.",module,Magento_ImportExport
"The source file moving process failed.","Le processus de déplacement du fichier source a échoué.",module,Magento_ImportExport
"The source is not set.","La source n'est pas définie.",module,Magento_ImportExport
"The total size of the uploadable files can't be more than %1M","La taille totale des fichiers ne peut pas être supérieure à %1M",module,Magento_ImportExport
"The validation is complete.","La validation est terminée.",module,Magento_ImportExport
"This file does not contain any data.","Ce fichier ne contient pas de données.",module,Magento_ImportExport
"This file is empty. Please try another one.","Ce fichier est vide. Veuillez en essayer un autre.",module,Magento_ImportExport
"To","À",module,Magento_ImportExport
"Unknown attribute filter type","Type de filtre attribut inconnu",module,Magento_ImportExport
"Uploaded file has no extension","Le fichier uploadé n'a pas d'extension",module,Magento_ImportExport
"URL key for specified store already exists.","La clé d'URL pour la boutique existe déjà.",module,Magento_ImportExport
"User","Utilisateur",module,Magento_ImportExport
"Validation finished successfully","Succès lors de la validation",module,Magento_ImportExport
"Validation Results","Résultat de validation",module,Magento_ImportExport
"We can't determine the attribute filter type.","Nous ne pouvons pas déterminer le type de filtre d'attribut.",module,Magento_ImportExport
"We can't filter an attribute with no attribute options.","Nous ne pouvons pas filtrer un attribut sans options d'attributs.",module,Magento_ImportExport
"We can't identify this file format.","Nous ne pouvons pas identifier ce format de fichier.",module,Magento_ImportExport
"We can't provide the upload settings right now.","Impossible de transmettre les paramètres d'upload.",module,Magento_ImportExport